{
  "schemaVersion": 2,
  "problemId": "bssc-sum-capacity",
  "subjectTransactionId": "5ed3f525b9ae7f32c6e1dcbf22ecdb5ae946a4a6",
  "beforeKnowledgeStateDigest": "sha256:8a05ec4e1aa8090ab8e2d69f3c3f109042d56bfbef93862a9252d9f69822a64b",
  "afterKnowledgeStateDigest": "sha256:caf85dc5201dd1c3a95027c1d9dd03d3be9e483b348fd9fe708c43d1f5562678",
  "topologyAlignmentDigest": "sha256:5d7e96f33d2c4bbdaf8bc049eceed07acfd42722cafd788efb29e2baf4775a62",
  "sameWorldReferenceStateDigest": "sha256:caf85dc5201dd1c3a95027c1d9dd03d3be9e483b348fd9fe708c43d1f5562678",
  "accountingNodeKinds": [
    "program"
  ],
  "semanticLeafKinds": [
    "intermediateResult"
  ],
  "handoffDigest": "sha256:54a5ef82dc45f80bdc75b44494d59256bc892add8a5367d5727ea325955ad51f"
}
