{
  "schemaVersion": 2,
  "problemId": "bssc-sum-capacity",
  "subjectTransactionId": "1be513bb3d8f67f54e299ea0085cd2ef05144711",
  "beforeKnowledgeStateDigest": "sha256:4d45188c4dccb0b3395330a8c838337b4ada0fc986395100131f210018edd7bf",
  "afterKnowledgeStateDigest": "sha256:f304ae66c58b0415964faf2ed4e4ae6de374faf44f25171c91dd079181d517f1",
  "topologyAlignmentDigest": "sha256:1ac72453822f5bed7fde18b8fbbd71fd799d0d8a425cead665fb88b94b1c7fc4",
  "sameWorldReferenceStateDigest": "sha256:f304ae66c58b0415964faf2ed4e4ae6de374faf44f25171c91dd079181d517f1",
  "accountingNodeKinds": [
    "program"
  ],
  "semanticLeafKinds": [
    "intermediateResult"
  ],
  "handoffDigest": "sha256:fabbcf59f7473583e66d0e6d5296baca0af0386fbbd5ffd070af5977552d2c3a"
}
